{
 "caps": {
  "attributed_linux_minutes": 4000,
  "calibration_trial_ids": 12,
  "configurations": 16,
  "engine_invocations": 240,
  "hyperopt": 0,
  "llm_agent_tokens": 0,
  "paid_actions_overage_usd": 0,
  "scientific_trial_ids": 5
 },
 "dag": {
  "edges": [
   {
    "from": "D0",
    "on": "PASS",
    "to": "CAL-A1"
   },
   {
    "from": "CAL-A1",
    "on": "PASS",
    "to": "PC-A1"
   },
   {
    "from": "PC-A1",
    "on": "SURVIVED",
    "to": "N-A1"
   },
   {
    "from": "N-A1",
    "on": "REJECTED",
    "to": "A1"
   },
   {
    "from": "A1",
    "on": "ANY_TERMINAL",
    "to": "HOLM"
   },
   {
    "from": "HOLM",
    "on": "HOLM_PASS",
    "to": "SC-A1"
   },
   {
    "from": "D0",
    "on": "PASS",
    "to": "CAL-A2"
   },
   {
    "from": "CAL-A2",
    "on": "PASS",
    "to": "PC-A2"
   },
   {
    "from": "PC-A2",
    "on": "SURVIVED",
    "to": "N-A2"
   },
   {
    "from": "N-A2",
    "on": "REJECTED",
    "to": "A2"
   },
   {
    "from": "A2",
    "on": "ANY_TERMINAL",
    "to": "HOLM"
   },
   {
    "from": "HOLM",
    "on": "HOLM_PASS",
    "to": "SC-A2"
   },
   {
    "from": "D0",
    "on": "PASS",
    "to": "CAL-A3"
   },
   {
    "from": "CAL-A3",
    "on": "PASS",
    "to": "PC-A3"
   },
   {
    "from": "PC-A3",
    "on": "SURVIVED",
    "to": "N-A3"
   },
   {
    "from": "N-A3",
    "on": "REJECTED",
    "to": "A3"
   },
   {
    "from": "A3",
    "on": "ANY_TERMINAL",
    "to": "HOLM"
   },
   {
    "from": "HOLM",
    "on": "HOLM_PASS",
    "to": "SC-A3"
   }
  ],
  "max_depth": 7,
  "max_nodes": 17,
  "nodes": [
   {
    "family": null,
    "id": "D0",
    "kind": "DATA_LOCK",
    "prereg_path": "research/auth2/prereg/D0.json",
    "prereg_sha256": "bd69c0da4f736f8080fe33dd37de43425c3b62f27d7ac2c4e6c38d5fbd9174a3",
    "trial_id": "TRIAL-AUTH2-D0"
   },
   {
    "family": "A1",
    "id": "CAL-A1",
    "kind": "CALIBRATION_STAT",
    "prereg_path": "research/auth2/prereg/CAL-A1.json",
    "prereg_sha256": "6c3e65a3da3bd674c630c28617eafba7b95d46ed0a0ce82cbea55c8e63572099",
    "trial_id": "TRIAL-AUTH2-CAL-A1"
   },
   {
    "family": "A2",
    "id": "CAL-A2",
    "kind": "CALIBRATION_STAT",
    "prereg_path": "research/auth2/prereg/CAL-A2.json",
    "prereg_sha256": "e5e6996049341f4674249cc74ded21b09636f01f076f3ed7a3f0931d816e3b53",
    "trial_id": "TRIAL-AUTH2-CAL-A2"
   },
   {
    "family": "A3",
    "id": "CAL-A3",
    "kind": "CALIBRATION_STAT",
    "prereg_path": "research/auth2/prereg/CAL-A3.json",
    "prereg_sha256": "a7cb37e220d88a783335dfc52e8ac77ad3ae5a13dc15e0b6a4a5d49bd6e5012c",
    "trial_id": "TRIAL-AUTH2-CAL-A3"
   },
   {
    "family": "A1",
    "id": "PC-A1",
    "kind": "POSITIVE_CONTROL",
    "prereg_path": "research/auth2/prereg/PC-A1.json",
    "prereg_sha256": "5390bf95ea4bbbc00fa649746ddb650b806aa2b9a87c13b3f8dd6b093538f280",
    "trial_id": "TRIAL-AUTH2-PC-A1"
   },
   {
    "family": "A2",
    "id": "PC-A2",
    "kind": "POSITIVE_CONTROL",
    "prereg_path": "research/auth2/prereg/PC-A2.json",
    "prereg_sha256": "7984b86e6c4cd9897ce469768a80e56de38f884789a13443075cac4dbdd21b5f",
    "trial_id": "TRIAL-AUTH2-PC-A2"
   },
   {
    "family": "A3",
    "id": "PC-A3",
    "kind": "POSITIVE_CONTROL",
    "prereg_path": "research/auth2/prereg/PC-A3.json",
    "prereg_sha256": "18fe2c313631b4a846bebc4fe6d19286e0e316bf85282b25cb8e94ade903caee",
    "trial_id": "TRIAL-AUTH2-PC-A3"
   },
   {
    "family": "A1",
    "id": "N-A1",
    "kind": "NULL_CALIBRATION",
    "prereg_path": "research/auth2/prereg/N-A1.json",
    "prereg_sha256": "b017fe6c20418514a1a86ec42fd569b427afe2267b4e30ff19dba0af99cc11b8",
    "trial_id": "TRIAL-AUTH2-N-A1"
   },
   {
    "family": "A2",
    "id": "N-A2",
    "kind": "NULL_CALIBRATION",
    "prereg_path": "research/auth2/prereg/N-A2.json",
    "prereg_sha256": "0d955330c3f3c770faeef5405a2f65ffb39beb58d97ff34d906d7a419e547955",
    "trial_id": "TRIAL-AUTH2-N-A2"
   },
   {
    "family": "A3",
    "id": "N-A3",
    "kind": "NULL_CALIBRATION",
    "prereg_path": "research/auth2/prereg/N-A3.json",
    "prereg_sha256": "ee2c5c308a0e6ff710aaeae7bad42ec946c82bfd3d9c868691b3165804b81ad3",
    "trial_id": "TRIAL-AUTH2-N-A3"
   },
   {
    "family": "A1",
    "id": "A1",
    "kind": "SCIENTIFIC",
    "prereg_path": "research/auth2/prereg/A1.json",
    "prereg_sha256": "5ac49a14ec88acd206ba9c439cbe151e566acd5cf534712a19fb5e09e9f467a5",
    "trial_id": "TRIAL-AUTH2-A1"
   },
   {
    "family": "A2",
    "id": "A2",
    "kind": "SCIENTIFIC",
    "prereg_path": "research/auth2/prereg/A2.json",
    "prereg_sha256": "3b247b8d8e47844083ab27bfb54e35abf9a34899b93a8e7af2a7df17ddd33275",
    "trial_id": "TRIAL-AUTH2-A2"
   },
   {
    "family": "A3",
    "id": "A3",
    "kind": "SCIENTIFIC",
    "prereg_path": "research/auth2/prereg/A3.json",
    "prereg_sha256": "e5107fc3620bfe8741882f06efc4b48940d93213180c8f4c52bd7d6ec7aa9229",
    "trial_id": "TRIAL-AUTH2-A3"
   },
   {
    "family": null,
    "id": "HOLM",
    "kind": "HOLM",
    "prereg_path": "research/auth2/prereg/HOLM.json",
    "prereg_sha256": "4d40f0ef4dadc5a3c564a498ff0ffa091ca61429b4d246920589a0218139dda7",
    "trial_id": "TRIAL-AUTH2-HOLM"
   },
   {
    "family": "A1",
    "id": "SC-A1",
    "kind": "SECONDARY_CONFIRM",
    "prereg_path": "research/auth2/prereg/SC-A1.json",
    "prereg_sha256": "a298be2d568f09a2050bef40ad4831531998068d3fe99d3fe8bd8e81d766f1ca",
    "trial_id": "TRIAL-AUTH2-A1"
   },
   {
    "family": "A2",
    "id": "SC-A2",
    "kind": "SECONDARY_CONFIRM",
    "prereg_path": "research/auth2/prereg/SC-A2.json",
    "prereg_sha256": "80b3db0f099e1cb0b98717bed7333214a1f71c69bbabccfc7d2d6f72d20ae98f",
    "trial_id": "TRIAL-AUTH2-A2"
   },
   {
    "family": "A3",
    "id": "SC-A3",
    "kind": "SECONDARY_CONFIRM",
    "prereg_path": "research/auth2/prereg/SC-A3.json",
    "prereg_sha256": "dec0f5e4e5f597e3f2f21d99f277f3ee23bab4759ee09bd90d2a5c78ce3a26b6",
    "trial_id": "TRIAL-AUTH2-A3"
   }
  ]
 },
 "dataset_lock": "research/datasets/dataset_v3.lock.json",
 "development_window": {
  "end": "2024-12-31",
  "start": "2019-01-01"
 },
 "families": [
  {
   "hypothesis_class": "TSMOM-VT: per-sleeve time-series momentum with volatility targeting on point-in-time U6, long or cash",
   "id": "A1",
   "inherited_n": 15
  },
  {
   "hypothesis_class": "XSMOM-LO: weekly cross-sectional momentum, top 3 of point-in-time U12 with a cash gate, long or cash",
   "id": "A2",
   "inherited_n": 0
  },
  {
   "hypothesis_class": "CROWD-OVERLAY (risk-overlay experiment): BTC/ETH volatility-targeted base cut to 50% while 7-day mean funding is crowded (z > 2)",
   "id": "A3",
   "inherited_n": 0
  }
 ],
 "frozen_hashes": {
  "config_n_py": {
   "path": "research/auth2/families.py",
   "sha256": "6fe8d9057b78c6bdccd37095c3d572649c275541b26c6340f2c40b3130b4ee6d"
  },
  "funnel_law": {
   "path": "research/auth2/FUNNEL_LAW_2.md",
   "sha256": "8aa91f5ec18cca488fdf3b4051f24fb41c11070faddafe5f866631d0c3234da5"
  },
  "funnel_py": {
   "path": "research/auth2/gates.py",
   "sha256": "23c8aa41cc28b8ab2ade101a5d2169cb4869e6d5fb6edf3e048115783ab4868f"
  },
  "multiple_testing_py": {
   "path": "research/auth2/stats.py",
   "sha256": "894e74e5ea0677c89acda3e369fe24b644386a95be4c95a9044f5e5b6e916020"
  }
 },
 "holdout_law": "Option B unchanged: the first strict holdout is prospective live-market paper. The secondary segment 2025-01-01..2026-08-31 is non-pristine and reject-only (C10). A3 is scored from the lock's A3_START.",
 "n_law": "Cumulative family configuration N for DSR: A1 = 21 (15 inherited + 6), A2 = 6, A3 = 4; the H1 upstream 42-strategy debt is disclosed, not folded in; lifetime TLOS configurations 19 + 16 = 35.",
 "null_calibration_first": true,
 "program_id": "AUTH-2-DISCOVERY-QUALIFICATION-1",
 "schema_version": 2,
 "status": "ACTIVE",
 "stop_rules": [
  "a node outside this DAG, or a node whose predecessor did not end in the edge's state, never runs",
  "CAL-Ax size FAIL => family LAW_INVALID; power FAIL or PC-Ax not SURVIVED => INCONCLUSIVE_UNDERPOWERED; N-Ax not REJECTED => LAW_INVALID; DATA_LIMITED at D0 => the family has no further node",
  "one family's calibration failure never stops another family",
  "any C1 integrity failure => INVALID_RUN; one technical retry within caps, otherwise STOP_PROGRAM",
  "HOLM is the join: it runs once every family is terminal; a family without a scientific p-value enters with p = 1",
  "any cap (240 invocations, 4,000 attributed minutes, USD 0 overage, monthly reserve) => no dispatch",
  "DAG exhausted => closure record (terminal) and STOP"
 ],
 "terminal": "closure_record",
 "version": 1
}
